Id,Name,Scientific name,Binomial,Plant Type,Height,Spread,Root Depth,Seasonal Interest,Notes,Flower Color,Root Type,Bloom Time,Fruit Time,Texture,Form,Growth Rate,Insect Predation,Disease,Light,Hardiness Zone,Soil Moisture,Soil pH,Ecological Function,Human Use/Crop
3421,"Achoccha (Caighua, Kaywa)",Cyclanthera pedata,CYPE,Annual,480,120,8,Summer,"""Requires a very warm, sunny and sheltered position in a rich well-drained soil. It is a climbing member of the cucumber family that can be used as a vegetable in salads, or steamed, it has a nice sweet flavor. It is also an herbal plant, the fruit has anti-inflammatory, weight reducing ( it is often sold in capsule form as a natural weight loss product ), lipid-absorbing, cholesterol and blood sugar regulating affects. Can easily be grown in the garden, on a fence or trellis. It is an annual plant. One of the most interesting aspects of the plants is that when ripe, the fruits become spring-loaded missile devices, splitting and turning themselves inside-out to launch their seeds up to 5-6 feet away into the garden. This is quite the conversation plant. The achocha is occasionally cultivated for its edible fruit in S. America, there are many named forms. The fruit flesh is soft and spongy, not crunchy, only 0.5 cm thick, and is said to have a flavor resembling that of cucumbers. Except for the flesh and the 12 or so seeds attached to one placenta lobe, the fruit is hollow. This species is day-length sensitive, like other cucurbits originating from low-latitude regions, requiring sh","Green, White",Fibrous Shallow,Early Summer - Early Fall,Summer - Fall,Fine,Vine,Fast,Minor,Minor,"Full_Sun, Partial_Shade",9 -- 11,Moderate,6.0 - 6.5,Insectory,"Fiber, Food, Food, Food, Medicine"
1974,Alfalfa (including cultivars),Medicago sativa .,MESA,Annual,36,12,1000,Summer,"Violet, yellow, purple, and blue flowers in May to June",,Rhizome,,,Medium,Upright,Fast,Minor,Minor,Full_Sun,2 -- 9,"Moderate, Dry",6.0 - 8.0,"Domestic Animal Forage, Dynamic Accumulator, Insectory, Nitrogen Fixer, Nurse, Reclamator, Soil Cultivator, Wildlife Food, Wildlife Habitat",Food
2044,Amaranth (Grain),Amaranthus hypochondriacus,AMHY,Annual,40,24,36,Summer,"Colors most brilliant in poor soils; most varieties have red, yellow or gold leaves. Lygus lineolaris, an insect pest, can be controlled by planting strips of alfalfa.Non mycorrhizal. Most if not all members of this genus photosynthesize by a more efficient method than most plants. Called the 'C4 carbon-fixation pathway', this process is particularly efficient at high temperatures, in bright sunlight and under dry conditions. This is the most robust and highest yielding of the grain amaranths, though it is late maturing and therefore less suitable for northern areas[183 ]. It is often cultivated, especially in tropical areas, for its edible leaves and seeds, there are many named varieties.",Orange,"Tap, Tap",Summer - Late Summer,Fall,Coarse,Upright,Fast,Minor,Minor,"Full_Sun, Partial_Shade",2 -- 9,"Wet, Moderate, Dry",4.0 - 7.5,"Domestic Animal Forage, Dynamic Accumulator, Insectory, Nurse, Reclamator","Dye, Food, Medicine, Ornamental"
2596,Globe Amaranth,Gomphrena globosa,GOGL,Annual,18,15,,Summer,"Excellent flower for drying. White, red, pink and purple flower colors.","Pink, Purple, Red, White",,Early Summer - Early Fall,,Medium,Upright,Fast,Minor,Minor,Full_Sun,2 -- 9,Moderate,6.2 - 7.0,,"Cut Flower, Dried Flower"
3147,Spiny Amaranth,Amaranthus spinosus,AMSP,Annual,60,50,0,,"Monoecious. Self and wind pollinated, dispersed by various animals. Prefers well-drained, rich loams.",Green,"Tap, Fibrous Deep",Summer - Fall,Summer - Fall,Coarse,Upright,Fast,Medium,Minor,Full_Sun,4 -- 8,Moderate,5.0 - 7.0,Domestic Animal Forage,"Compost, Dye, Food, Medicine"
3426,Thorn Apple,Datura metel,DAME,Annual,48,48,8,Summer,"""Prefers a rich light sandy soil and an open sunny position. Grows best in a fertile calcareous soil. This species is extremely susceptible to the various viruses that afflict the potato family (Solanaceae), it can act as a centre of infection so should not be grown near potatoes or tomatoes. There are a number of named varieties selected for their ornamental value. The flowers have an exotic fragrance, though the bruised leaves have an unpleasant smell. This species is closely related to D. innoxia."" Foliage emits a disagreeable odor when bruised or crushed. Single or double, upward-facing trumpets (to 7” long and 4” wide at the mouth) have a sweetly overpowering fragrance. Flowers come in a variety of colors, including white, yellow, lilac and dark purple. Each flowers lasts only one night. From an unusual cigar-shaped flower bud, each flower will unravel in the evening to reveal a fragrant trumpet-shaped bloom that only lasts until noon the following day. Flowers will typically bloom intermittently from mid-summer to frost. Flowers are followed by thorny, spherical fruit. Propagation: Seed - best pre-soaked for twelve hours in warm water before sowing. Seed can be sown in s","Lavender, White, Yellow",Fibrous Deep,Summer - Fall,Fall,Coarse,Upright,Fast,Minor,Minor,Full_Sun,9 -- 10,"Moderate, Dry",6.5 - 7.5,"Aromatic Pest Confuser, Insecticide, Insectory","Aromatics/Fragrance, Container Garden, Dye, Food, Medicine, Medicine, Medicine, Medicine"
2514,"Arrow-Leaved Tearthumb (Arrow Vine, Scratch Grass)",Persicaria sagittata,PESA,Annual,48,10,6,Summer,"Arrow-leaved Tearthumb is an annual with a fibrous root system, growing each year by reseeding. Common in bogs, marshes and wet meadows. The arrow-shaped leaves and prickly stems helps to distinguish arrow-leaved Tearthumb from most other aquatic shoreline weeds. Tearthumb is commonly found in tidal freshwater marshes in the mid-Atlantic states, but frequently occurs in nontidal wetlands as well. The plant appears to prefer open wetlands such as marshes, wet meadows, ditches, pond margins and along the borders of swamps. It is often found in flooded conditions.","Pink, White",Fibrous Shallow,Early Summer - Late Summer,Summer - Fall,Medium,Prostrate,Fast,Minor,Minor,"Full_Sun, Partial_Shade",2 -- 9,"Wet, Moderate",4.0 - 8.0,"Insectory, Wildlife Food, Wildlife Habitat",Medicine
2458,Arugula,Eruca vesicaria,ERVE,Annual,12,12,4,Summer,"A very easily grown and fast-maturing plant, it succeeds in most soils and conditions, though it prefers some shade in summer. Non mycorrhizal. Habitat: Rubbish tips, harbours, loading areas.","Cream, White, Yellow","Fibrous Shallow, Short Rhizome",Late Spring - Late Summer,Summer - Fall,Medium,Mound,Fast,Minor,Minor,"Full_Sun, Partial_Shade",3 -- 9,"Moderate, Dry",4.5 - 7.5,"Insecticide, Reclamator","Biomass, Essential Oil, Food, Medicine, Oil, Wax, Resin or Polish"
3092,Asparagus-Pea (Winged Pea),Lotus tetragonolobus,LOTE,Annual,12,24,4,Spring-Summer,"Synonymous with Tetragonolobus purpureus. Range: Mediterranean - Portugal to Italy, Greece, Turkey, southern Caucasus and the Levant; Morocco to Egypt. Grows best in light, well-drained soils. Tolerant of low-nutrient soils. Propagation: Pre-soak the seed for 24 hours in warm water and then sow in situ in the spring. The seed usually germinates in 2 - 4 weeks at 15°c.",Red,"Tap, Short Rhizome",Spring - Summer,Summer - Fall,Fine,Spreading,Fast,Minor,Minor,Full_Sun,10 -- 11,"Wet, Moderate",6.0 - 7.5,"Groundcover, Insectory, Nitrogen Fixer","Container Garden, Food, Medicine, Ornamental"
2463,Tall Matsumoto Aster,Callistephus chinensis,CACH,Annual,30,8,,Summer-Fall,Blooms only 14 weeks after sowing - quite impressive for a tall Aster! Matsumoto is one of the 'new' varieties - disease resistant compared to some of the old varieties. Heat tolerant.,White,,Early Summer - Early Fall,,Medium,Upright,Fast,Minor,Minor,Full_Sun,2 -- 9,Moderate,,,Cut Flower
3195,Asthma Weed,Euphorbia hirta,EUHI,Annual,12,12,0,,"Monoecious, pollinated by insects. Best in well-drained soils.","Green, Purple",Tap,Winter - Fall,,Medium,Prostrate,Fast,Medium,Medium,Full_Sun,9 -- 11,Moderate,6.1 - 7.8,"Domestic Animal Forage, Insecticide, Insectory","Food, Medicine"
7422,Baby Blue Eyes,Nemophila menziesii,NEME,Annual,6,15,4,Spring-Summer,"Best in fertile well-draining soils and prefers partial shade. This species contains 3 recognized subspeces. Easily grown by seed; doesn't transplant well. Deadhead to prolong flowering and pinch to produce bushier growth. Self-sowing in mulch-free environments. This is an annual that grows best in cool summer climates where nighttime temperatures consistently dip below 65 degrees F. In hot summer climates with cold winters, sow seed indoors 6-8 weeks before last spring frost date for bloom from spring until the heat of summer arrives. In hot climates with mild winters (USDA Zones 8-10), sow seed in late summer and late fall for winter to spring bloom. Plants will self seed in the garden in optimum conditions.","Blue, White",Fibrous Shallow,Late Winter - Early Summer,Summer - Fall,,Spreading,Fast,Minor,Minor,"Full_Sun, Partial_Shade",7 -- 11,"Wet, Moderate, Dry",5.5 - 8.0,"Domestic Animal Forage, Groundcover, Insectory, Insectory","Container Garden, Container Garden, Hanging Basket, Ornamental, Ornamental"
3433,Moldavian Balm (Badarshoo),Dracocephalum moldavica,DRMO,Annual,18,24,6,Spring-Summer,"This is a superior lemon scented tea herb that can be started by direct seeding in the garden. Easy germination, fast growth, and mintily tasty leaves typify this old time plant. Traditional usage (TWM): common cold. Plant prefers full sun to part shade, water, average soil. Propagation: Seed - sow early spring in situ. Pinch back the shoot tips in May in order to encourage bushy growth.","Blue, Purple, White",Fibrous Shallow,Early Summer - Late Summer,Summer - Fall,Medium,Upright,Fast,Minor,Minor,"Full_Sun, Partial_Shade",10 -- 12,Moderate,6.0 - 8.0,"Insecticide, Insectory","Food, Medicine, Medicine, Medicine, Oil, Wax, Resin or Polish, Ornamental, Soap"
3488,Himalayan Balsam (Custodian Helmet),Impatiens glandulifera,IMGL,Annual,60,36,6,Spring-Summer,". glandulifera is a tall glabrous annual reaching 50 to 250 cm in height. It is now Europe’s tallest annual species. Its stems can be 0.5 to 5 cm in diameter and are sometimes branched in the upper part. Roots are up to 15 cm deep, the plants often forming numerous adventitious roots from the lower nodes. In Europe, I. glandulifera is predominantly a weed of riparian systems where it can form dense monocultures along river banks. I. glandulifera is also found in damp natural woodland, where it can attain is maximum known height (up to 3m), in addition the plant is found in forest plantations, forest clearings, railway embankments, waste ground, urban areas, roadside ditches and wet meadows. This plant has seed capsules that spring open forcibly as the seed ripens to eject the seed a considerable distance. The capsules are sensitive to touch even before the seed is ripe, making seed collection difficult.","Pink, Purple, White","Tap, Short Rhizome",Early Summer - Late Summer,Summer - Fall,Medium,Upright,Fast,,,"Full_Sun, Partial_Shade",11 -- 12,"Wet, Moderate",6.1 - 7.8,"Domestic Animal Forage, Insectory","Food, Food, Medicine, Oil, Wax, Resin or Polish"
1985,Barley,Hordeum vulgare,HOVU,Annual,48,12,72,Summer,"Barley can be grown further north and produce more biomass than any other cereal crop. Barley is an ubiquitous cereal and can grow in a wide range of climates. Barley forage is mostly used in North America, Europe and the Mediterranean area. Barley forage is better suited to cooler, drier areas than other small grain cereals. Barley is best adapted to rich, well-drained, loamy soils and should not be planted on poor, sandy or wet soil. It prefers a soil pH above 6. Barley can withstand moderate droughts and does well on alkaline and saline soils. It is less winter hardy than wheat or rye. Barley is sensitive to rust and disease: it should not be sown in milder climates or too early during autumn. Barley forage can be sown as the sole crop or in mixture with a legume such as vetch, pea, berseem (Trifolium alexandrinum) or Persian clover (Trifolium resupinatum). Intercropping is effective for reducing diseases, suppressing weeds and capturing a greater share of available resources: intercropped barley-legumes have a higher total yield than barley or legume as a sole cropal. Intercropping barley with a legume improves the nutritive value by increasing the DM and protein content of th",Green,Fibrous Deep,Spring - Early Summer,Summer,Medium,Upright,Fast,Medium,Medium,Full_Sun,2 -- 9,"Moderate, Dry",6.0 - 8.0,"Domestic Animal Forage, Dynamic Accumulator, Erosion Control, Fungicide, Groundcover, Insectory, Nitrogen Scavenger, Nurse, Nurse, Reclamator, Soil Builder","Biomass, Fiber, Food, Medicine"
2048,Basil,Ocimum basilicum,OCBA,Annual,18,12,4,Summer,Spires of small purple flowers,"Pink, Purple, White","Fibrous Shallow, Short Rhizome",Summer - Late Summer,,Medium,Upright,Fast,Minor,Medium,Full_Sun,2 -- 9,Moderate,0.0 - 0.0,Aromatic Pest Confuser,"Container Garden, Essential Oil, Food, Insect Repellent, Medicine"
2201,Bush Bean,Phaseolus vulgaris (bush),PHVU,Annual,12,12,0,Summer,White flower,,Fibrous Deep,,,Medium,Upright,Fast,Minor,Minor,Full_Sun,2 -- 9,"Moderate, Dry",5.5 - 6.5,"Fungicide, Nitrogen Fixer",
1995,Faba (Broad) Bean,Vicia faba,VIFA,Annual,72,5,0,Summer,"Flowers are large, white with dark purple markings",White,Tap,Early Summer - Summer,,Medium,Climbing,Fast,Major,Major,Full_Sun,2 -- 9,Moderate,4.5 - 8.3,"Nitrogen Fixer, Soil Cultivator","Fiber, Food, Soap"
2200,Pole Bean,Phaseolus vulgaris (pole),PHVU,Annual,72,12,0,Summer,White flower,,Fibrous Deep,,,Medium,Vine,Fast,Minor,Minor,Full_Sun,2 -- 9,"Moderate, Dry",5.5 - 6.5,"Fungicide, Nitrogen Fixer",
7006,Velvet Bean,Mucuna pruriens,MUPR,Annual,160,160,0,Spring-Fall,"Can grow to 18m (60ft) in length on a support structure or along the ground. Sometimes biennial. Some cultivars have been developed that are more tolerant of temperate climates. Needs well-drained soils, tolerant of nutrient-poor soils. Contact with seeds can cause itchiness in wild forms (var. pruriens) but not cultivated forms (var. utilis).","Purple, Red, White",Fibrous Shallow,Early Summer - ?,Summer - ?,Medium,Vine,Fast,Minor,Minor,Full_Sun,8 -- 11,Moderate,4.5 - 7.0,"Domestic Animal Forage, Erosion Control, Groundcover, Insecticide, Nitrogen Fixer, Reclamator, Soil Builder, Soil Cultivator","Compost, Food, Medicine, Ornamental"
8742,Basil Beebalm,Monarda clinopodioides,MOCL,Annual,12,48,8,Spring-Summer,"Monarda clinopodioides, common name Basil Beebalm, is an annual herb species native to Kansas, Oklahoma, Louisiana & Texas. - Basil Beebalm is native to the eastern and midwestern United States, but enters New England only as an introduced species. It is popularly grown in gardens as a native wildflower & may escape cultivation into disturbed areas. HABITAT: Anthropogenic (man-made or disturbed habitats), sandy soils of prairies and pastures, occasionally on granite in meadows, fields, grassy flats and grassy areas in open woodlands. - ELEVATION: Up to 4,000 feet. - PROPAGATION: Seeds (Yellow-brown to brown, with short, nipplelike point at top Stem cuttings. Root divisions. The fruit is dry but does not split open when ripe. - Flower bisexual, bilateral - The genus Monarda gets its name from the Spanish botanist, physician, and explorer Nicholas Monardes (1512-1588), who wrote one of the seminal European works on American plants. Resistant to deer. Spreads rapidly by underground stolons. Once the flower fades & the petals drop off, a brown seed head develops. It is best to allow the seed heads to dry on the plant & then collect the seeds.","Pink, Purple, Red, White, Yellow","Rhizome, Fibrous Shallow",Late Spring - Early Summer,Summer - Fall,Fine,Upright,Moderate,Minor,Minor,"Full_Sun, Partial_Shade",6 -- 10,Moderate,5.1 - 8.0,"Insectory, Insectory, Wildlife Food, Wildlife Habitat","Aromatics/Fragrance, Cut Flower, Essential Oil, Food, Medicine, Medicine, Medicine"
2060,Beet,Beta vulgaris craca,BEVU,Annual,12,6,,Summer,"The beetroot is widely cultivated, especially in temperate zones, for its edible root. There are two basic forms, those with rounded roots and those with elongated roots with many named varieties of each form.",,Tap,Early Summer - Early Fall,,Medium,Upright,Fast,Minor,Minor,"Full_Sun, Partial_Shade",2 -- 9,Moderate,6.0 - 6.8,Dynamic Accumulator,"Food, Medicine"
3157,"Hairy Beggar's Ticks (Spanish Needle,Bur Marigold)",Bidens pilosa,BIPI,Annual,40,30,6,,"Flowers year round. Self-fertile, cross-pollinated by insects. Fruits have burrs that cling to people and animals for dispersal. Morphology very variable. 4-5 successive plantings are possible per year. A pantropical weed, where it can be found at elevations up to 3,600 metres. It prefers temperatures above 15°c and below 45°c, but is tolerant to frosts and has roots capable of withstanding and regenerating after temperatures as low as -15°c. Succeeds in any moderately fertile moisture-retentive soil in full sun. Plants can grow in a vast range of habitats ranging from moist soil, sand, lime rock, or dry, infertile soil Plants are tolerant of a pH range from 4 - 9 and also highly saline soils. Plants can tolerate severe droughts. A fast-growing plant, flowering starts 6 weeks after emergence and continues until plant senescence 2 - 3 months later. The plants are ready for harvesting within 4 - 6 weeks of emergence, before seed setting. Harvesting is done by hand picking, cutting or uprooting. If the plants are topped, a second harvest can follow after 2 weeks. Up to 6 harvests are possible. There may be 4 or 5 successive plantings within a year. If it is grown for harvesting the l","Pink, White, Yellow","Tap, Short Rhizome",Early Summer - Fall,Summer - Fall,Medium,Upright,Fast,Minor,Minor,Full_Sun,10 -- 13,Moderate,4.0 - 9.0,"Domestic Animal Forage, Insecticide, Insectory","Dye, Fiber, Food, Food, Medicine, Medicine, Ornamental"
2504,Nodding Beggar's Ticks (Nodding Bur-Marigold),Bidens cernua,BICE,Annual,36,12,8,Summer-Fall,Another name for beggarticks is stick-tights. Walking through a stand of these plants in late summer or autumn results in numerous barbed nutlets adhering to clothing.,Yellow,Fibrous Shallow,Late Summer - Early Fall,,,Upright,Fast,Minor,Minor,"Full_Sun, Partial_Shade",2 -- 9,"Wet, Moderate",5.1 - 7.0,"Insectory, Wildlife Food",Medicine
2628,Tuberous Begonia,Begonia tuberhybrida,BETU,Annual,24,18,6,Summer-Fall,,"Orange, Pink, Red, White, Yellow",Tuber,Summer - Early Fall,,Medium,Irregular,Fast,Minor,Medium,"Partial_Shade, Shade",2 -- 9,Moderate,5.5 - 8.0,,"Container Garden, Food"
3544,Wild Black Cumin (Horse Black Cumin),Nigella arvensis,NIAR,Annual,14,12,4,Summer-Fall,"Distribution: Mediterranean Woodlands and Shrublands, Semi-steppe shrublands, Shrub-steppes. Nigella is probably native to western Asia where it grows both wild and cultivated. Nigella seeds are self-sowing if the seed pods are left to mature. Suitable for town, city or coastal gardens, in beds and borders. Ideal as an infill between other plantings.","Blue, White","Fibrous Shallow, Rhizome",Early Summer - Late Summer,Summer - Fall,Fine,Upright,Fast,Minor,Minor,"Full_Sun, Partial_Shade",10 -- 12,"Moderate, Dry",5.5 - 7.0,Insectory,"Aromatics/Fragrance, Dried Flower, Essential Oil, Food, Food, Insect Repellent, Medicine, Medicine, Medicine, Ornamental"
1975,Black Medic,Medicago lupulina,MELU,Annual,24,12,48,Summer,"Yellow flowers; black, coiled pods. a common, prostrate broadleaf weed that is found throughout the US and Southern Canada. Native to Europe and temperate Asia, this member of the legume family (Fabaceae) has a few other common names including yellow trefoil, black clover and hop medic. Its is most often found as a weed in in dry, sunny areas in turf and waste ground, such as along roadsides and railroads, but it can be a nuisance in gardens and fi elds as well. Black medic can be an indication of low soil nitrogen in lawns as it outcompetes weak grass. Black medic and white clover grow in similar sites and are often found growing together in turf.",Yellow,"Tap, Rhizome",Early Summer - Summer,Summer - Fall,Medium,Upright,Fast,Minor,Minor,Full_Sun,2 -- 9,"Moderate, Dry",6.0 - 7.5,"Domestic Animal Forage, Dynamic Accumulator, Erosion Control, Groundcover, Nitrogen Fixer, Nurse",Food
2468,Black-Eyed Susan Vine,Thunbergia alata,THAL,Annual,120,6,,Summer,"Very fast growing vine has vibrant orange, yellow and white flowers which contrast brilliantly with the solid black 'eyes.'","Orange, White, Yellow",,Early Summer - Early Fall,,Medium,Trailing,Fast,Minor,Minor,Full_Sun,2 -- 9,"Moderate, Dry",,,Hanging Basket
7501,Gordon's Bladderpod,Physaria gordonii (Lesquerella gordonii),PHGO,Annual,16,36,0,Spring-Summer,"Stems are trailing or erect. Can be an annual, biennial, or short-lived perennial.",Yellow,Tap,Late Winter - Summer,Summer - ?,Medium,Prostrate,Moderate,Minor,Minor,"Full_Sun, Partial_Shade",9 -- 11,"Moderate, Dry",7.5 - 8.5,"Domestic Animal Forage, Groundcover, Wildlife Food",Ornamental
2063,Borage,Borago officinalis,BOOF,Annual,24,18,10,Summer,"Blue to purple flowers appear throughout the season. No mycorrhizal associations. Easily grown in average, dry to medium moisture, well-drained soils in full sun to light shade. Tolerates poor soils and drought. It is an annual, but readily self-seeds","Blue, Purple, White",Tap,Early Summer - Late Summer,Summer - Fall,Coarse,Mound,Fast,Minor,Minor,"Full_Sun, Partial_Shade",2 -- 11,Moderate,4.5 - 8.3,"Dynamic Accumulator, Insectory, Mulch Maker","Container Garden, Food, Medicine, Medicine, Oil, Wax, Resin or Polish"
2222,Broccoli,Brassica oleracea italica,BROL,Annual,30,24,6,Summer,Broccoli is a hardy vegetable of the cabbage family that is high in vitamins A and D. It develops best during cool seasons of the year.,Yellow,Tap,Late Spring - Late Summer,,,Upright,Fast,Medium,Minor,"Full_Sun, Partial_Shade",2 -- 9,Moderate,7.0 - 8.0,Insecticide,"Food, Medicine"
2578,Brussels Sprouts,Brassica oleracea gemnifera,BROL,Annual,36,24,5,Summer,"Brussels sprouts need a long cool growing season, and can withstand hard frosts and even snow. Crop rotation every 2-4 years for Brussels sprouts and other members of the Brassicaceae (aka Cruciferae or crucifer) family is recommended.",Yellow,Fibrous Shallow,,,,Upright,Fast,Medium,Medium,Full_Sun,2 -- 9,Moderate,6.0 - 8.0,,Food
1983,Buckwheat,Eriogonum Michx,ERMI,Annual,36,12,10,Spring,Buckwheat is an affective phosphorus scavenger,,Fibrous Shallow,,,,Upright,Fast,Minor,Minor,Full_Sun,2 -- 9,Moderate,6.0 - 7.0,"Chemical Barrier, Dynamic Accumulator, Groundcover, Insectory, Nurse, Soil Cultivator",Food
3531,"Toothed Bur-Clover (Burr-medic, Toothed Medic)",Medicago polymorpha,MEPO,Annual,20,20,6,Spring-Summer,"M. polymorpha is an annual or sometimes a biennial plant, reproducing entirely by seed. Depending on the climatic zone in which plants originate, they can be obligatory or facultative long-day plants. Bur clover (Medicago polymorpha L.) is a Mediterranean winter and annual clover. It is fast-growing, easily reseeds, an annual sprawling legume. Its stems are weak and reach a length of 60-75 cm. They often root from the nodes. In thick stands, the stems may become erect, reaching to a height of 60 cm. The root system has a tap root that is difficult to pull out when established. Improves soils and provides good quality forage to grazing livestock.",Yellow,"Tap, Fibrous Shallow",Late Spring - Fall,Summer - Fall,Medium,Matlike,Fast,Medium,Medium,"Full_Sun, Partial_Shade, Shade",10 -- 12,"Moderate, Dry",4.7 - 8.0,"Domestic Animal Forage, Erosion Control, Insectory, Nitrogen Fixer, Nitrogen Scavenger, Soil Builder",Food
2074,Cabbage,Brassica oleracea capitata,BROL,Annual,12,16,,Summer,Flowers from May to August,,Fibrous Shallow,,,Medium,Rounded,Fast,Medium,Medium,"Full_Sun, Partial_Shade",2 -- 9,Moderate,6.0 - 7.0,,"Container Garden, Food, Medicine"
2590,Chinese (Napa) Cabbage,Brassica campestris pekinensis,BRCA,Annual,12,12,12,Spring,"Bright, light green, curly and ruffled leaves.",Yellow,Tap,Spring - Late Spring,,,Rosette,Fast,Minor,Minor,Full_Sun,2 -- 9,Moderate,5.0 - 8.0,,Food
2003,Caraway,Carum carvi,CACA,Annual,18,10,,Summer,Pink to white flowers June to July,"Pink, White",Tuber,Early Summer - Summer,,Fine,Upright,Fast,Minor,Minor,"Full_Sun, Partial_Shade",3 -- 7,Moderate,4.8 - 7.6,"Groundcover, Insectory, Soil Cultivator","Essential Oil, Food, Medicine"
2077,Carrot,Daucus carota sativus,DACA,Annual,12,6,0,Spring,,,Tap,,Spring - Summer,Fine,Upright,Fast,Minor,Minor,Full_Sun,2 -- 9,Moderate,6.1 - 8.5,,"Dye, Essential Oil, Food, Medicine"
