Id,Name,Scientific name,Binomial,Plant Type,Height,Spread,Root Depth,Seasonal Interest,Notes,Flower Color,Root Type,Bloom Time,Fruit Time,Texture,Form,Growth Rate,Insect Predation,Disease,Light,Hardiness Zone,Soil Moisture,Soil pH,Ecological Function,Human Use/Crop
6990,Papalo,Porophyllum ruderale,PORU,Annual,60,24,8,,"Leaves are only used fresh, Leaves are dotted with oil glands. Aka Anacyclus radiatus, Yerba porosa, papaloquelite, Cocalia porosus, Kleinie ruderalis.","Cream, Purple, White",Tap,Early Fall - Fall,Fall,Medium,Upright,Moderate,Minor,Minor,"Full_Sun, Partial_Shade",10 -- 10,"Moderate, Dry",6.5 - 7.5,"Aromatic Pest Confuser, Wildlife Food","Food, Medicine"
2023,Parsley,Petroselinum crispum,PECR,Annual,12,10,6,Summer,Flowers June-August,White,Tap,Early Summer - Late Summer,,Medium,Upright,Fast,Medium,Minor,"Full_Sun, Partial_Shade",2 -- 9,Moderate,5.3 - 7.3,"Aromatic Pest Confuser, Insectory","Container Garden, Essential Oil, Food, Insect Repellent, Medicine"
1712,Partridge Pea,Chamaecrista nictitans,CHNI,Annual,24,18,,Summer,"Attracts birds,cloudless giant sulphur, little yellow, antillean blue and hairstreak butterflies. Provides excellent larva food for all sulphur butterflies. Also known as Cassia fasciculata.",Yellow,Tap,Summer - Early Fall,,Fine,Spreading,Fast,Minor,Minor,"Full_Sun, Partial_Shade",4 -- 6,"Moderate, Dry",5.0 - 8.0,"Erosion Control, Insectory, Nitrogen Fixer, Nurse, Wildlife Food, Wildlife Food, Wildlife Habitat",
3118,"Peanut (Earthnut, Goober Pea)",Arachis hypogaea,ARHY,Annual,23,27,15,Spring-Summer,"Arachis hypogaea, or peanut, is a legume that is native to Central Brazil and now widely grown worldwide, mainly for its edible seeds. The species name hypogaea means ""under the earth"" and reflects that fact that the pods containing edible seeds grow below ground. The peanut is an herbaceous perennial, but grown as an annual. It produces flowers above ground, but develops the fruit below ground in a process known as geocarpy. There are runner and bunch types. Best in well-drained soils. Adventitious roots sometimes occur, root characteristics vary with soil. Self-pollinating. Require minimum amount of lime. Flowers 3-6 wks after planting. The attractive, low-growing ,yellow pea-like flowers pollinate themselves then produce a ‘peg’ that grows down and away from the plant into the soil from which the peanut seed pod will develop. Not known in a truly wild state. Suitable for tropics, subtropics and warm temperate regions, grown from 40°S to 40°N latitude. Peanut plants thrive in warm climates with full sun and well-drained, light, sandy, loam soil. Plants are not frost-hardy and are best grown in areas with long warm summers. Plant seeds in the spring after the ground has warmed, in",Yellow,"Tap, Tuber",Spring - Summer,Summer - Fall,Medium,Prostrate,Moderate,Major,Major,Full_Sun,7 -- 10,Moderate,5.5 - 7.0,"Domestic Animal Forage, Mulch Maker, Nitrogen Fixer, Soil Builder, Wildlife Food","Biomass, Fiber, Food, Food, Medicine, Medicine, Oil, Wax, Resin or Polish, Oil, Wax, Resin or Polish"
3148,Peruvian Ragweed,Ambrosia peruviana,AMPE,Annual,60,60,0,,Monoecious.,Yellow,,Early Spring - Summer,,Medium,Upright,Fast,,,Full_Sun,9 -- 11,Moderate,5.7 - 7.9,Insectory,"Essential Oil, Medicine"
2226,Petunia,Petunia Juss,PEJU,Annual,12,12,5,Summer,,,Short Rhizome,Late Spring - Early Fall,,Medium,Upright,Fast,Minor,Minor,"Full_Sun, Partial_Shade",2 -- 9,Moderate,5.5 - 6.0,Insectory,"Container Garden, Hanging Basket"
3408,Tickweed (Asian Spiderflower),Cleome viscosa,CLVI,Annual,59,48,12,Summer,"C. viscosa is a fast-growing herb of humid and warm habitats. It is commonly found growing as a weed in disturbed sites, gardens, rice paddies, pastures, orchards, abandoned lands, and along roadsides. C. viscosa grows in warm and wet conditions on sandy soils, but sometimes on calcareous and rocky soils. It is locally abundant as a naturalized weed in cultivated fields and in ruderal areas and grasslands from sea level up to 1000 m. C. viscosa is a fast-growing annual herb. The seeds have no dormancy and germinate readily after shedding. Plants start flowering 3–4 weeks after germination and the life cycle is about 3 months.",Yellow,"Fibrous Shallow, Rhizome",Summer - Late Summer,Fall,Fine,Rounded,Fast,Minor,Minor,Full_Sun,10 -- 11,"Moderate, Dry",5.5 - 7.0,"Insectory, Soil Builder","Biomass, Food, Food, Insect Repellent, Medicine, Oil, Wax, Resin or Polish"
3560,Lacy Phacelia,Phacelia tanacetifolia,PHTA,Annual,47,12,10,Spring,"Also called fiddlehead, tansy phacelia, purple tansy, and lacy scorpion weed. Tolerant of infertile soils. Prefers well-drained soils. Self-seeds under desirable conditions.","Blue, Purple",Fibrous Shallow,Early Spring - Late Spring,Summer - ?,Medium,Upright,Fast,Minor,Minor,Full_Sun,3 -- 10,"Moderate, Dry",6.4 - 8.6,"Domestic Animal Forage, Groundcover, Herbicide, Insectory, Mulch Maker, Soil Builder, Soil Cultivator, Water Purifier","Aromatics/Fragrance, Container Garden, Cut Flower, Food, Ornamental"
3310,Scarlet Pimpernel (Red Chickweed),Anagallis arvensis,ANAR,Annual,18,10,6,Spring-Summer,"Two naturally occurring subspecies or color forms are common: subsp. phoenicia with red flowers; and subsp. caerulea (or coerulea) with blue flowers. A. arvensis requires bare soil for germination, and is therefore only common in disturbed places. It requires moist soil but does not tolerate waterlogging, and for successful growth requires ample sunlight without undue shading. It tolerates ground frost to -10° C, but not frozen soil. The plant grows in a wide variety of soils so long as they are moist and well drained, and thrives near the sea and in sandy soils. The species appears most commonly as a winter annual in warmer climates and as a summer annual in colder areas and situations.A low-growing annual that resembles chickweed but has showy reddish-orange flowers. A low-growing annual with opposite leaves that have spots on the lower surfaces. This weed is often mistakenly identified as Common Chickweed (Stellaria media), however scarlet pimpernel has square stems and reddish-orange flowers while common chickweed has round stems and white flowers. Additionally, the purple spots on the lower leaf surfaces of scarlet pimpernel help to distinguish this weed from other similar we","Blue, Red",Fibrous Shallow,Late Spring - Late Summer,Fall,Medium,Prostrate,Moderate,Minor,Minor,"Full_Sun, Partial_Shade, Shade",9 -- 12,"Moderate, Dry",5.5 - 8.0,"Groundcover, Insectory","Food, Medicine, Soap"
3288,Ground Pine (Yellow Bugle),Ajuga chamaepitys,AJCH,Annual,6,12,4,Spring-Summer,"Ajuga chamaepitys is usually an annual or biennial species, which can also persist as a short-lived perennial when winter temperatures are relatively high. It flowers from June to September, but can last into October during mild autumns, and can begin flowering as early as April if some seedlings survived over winter.",Yellow,Fibrous Shallow,Spring - Late Spring,Summer - Fall,Medium,Clump,Fast,Minor,Minor,"Full_Sun, Partial_Shade",10 -- 11,Moderate,7.5 - 9.0,"Insecticide, Insectory, Reclamator","Aromatics/Fragrance, Medicine"
7485,Woolly Plantain (Pursh's Plantain),Plantago patagonica,PLPA,Annual,8,8,6,Spring-Fall,Sometimes listed as a short-lived perennial.,Yellow,Tap,Late Spring - Summer,Summer - Fall,Medium,Rosette,Moderate,Minor,Minor,Full_Sun,9 -- 11,"Moderate, Dry",6.4 - 9.0,"Domestic Animal Forage, Wildlife Food","Food, Medicine"
3556,"Corn Poppy (Flanders Poppy, Field Poppy)",Papaver rhoeas,PARH,Annual,24,12,2,Summer-Fall,"Papaver rhoeas is an annual. RANGE: Europe, including Britain, from Scandanavia south & east to N. Africa & temperate Asia. Native Range: Temperate Old World. HABITAT: A common weed of cultivated land & waste places, avoiding acid soils. Becoming far less frequent on cultivated land due to modern agricultural practices. Prefers a well-drained sandy loam in a sunny position. Does not do well on wet clay soils but succeeds in most other soils. Plants usually self-sow freely when growing in suitable conditions so long as the soil surface is disturbed. A polymorphic species, varying in leaf shape & flower color. Members of this genus are rarely if ever troubled by browsing deer or rabbits. PROPAGATION: Seed - Sow in spring in situ. - (Planting seeds in situ literally means “in place” or “on site” Poppies are flowers that like sowing in situ, & grow best with that method.) Best in cool summer climates. Appreciates some light afternoon shade in hot summer climates. Performs well in average garden soils as long as drainage is good. Intolerant of overly moist soils, particularly if poorly drained. Fruit is a black-seeded poppy-type capsule which explodes when ripe to distribute its seed.","Orange, Pink, Purple, Red, White, Yellow","Tap, Rhizome",Summer - Fall,Fall,Medium,Upright,Moderate,Minor,Minor,Full_Sun,3 -- 11,Moderate,6.5 - 7.5,"Insectory, Wildlife Food","Dye, Food, Food, Food, Food, Food, Ornamental, Ornamental"
3554,"Prickly Poppy (Klubbevalmue, Spikvallmo)",Papaver argemone,PAAR,Annual,16,14,2,Summer,"Papaver argemone is an annual plant. RANGE: Central & southern Europe, including Britain. ELEVATION: 0–984 feet - HABITAT: Light soils in the south of Britain, becoming rare in the north. In fields & disturbed soils (including ploughed). POLLINATION: Bees, Flies, Beetles, Self. Prefers a well-drained sandy loam in a sunny position. Does not do well on wet clay soils but succeeds in most other soils. Plants usually self-sow freely when growing in suitable conditions so long as the soil surface is disturbed. Members of this genus are rarely if ever troubled by browsing deer or rabbits. PROPAGATION: Seed - Sow in spring in situ. - (Planting seeds in situ literally means “in place” or “on site” Poppies are flowers that like sowing in situ, & grow best with that method.) Prickly poppies are distinguished from other species in the genus Argemone by the lack of spines on the upper sides of leaves. CULTURE: The petal of the poppy, was once used in folklore, as a test of faithfulness. A petal was placed in the palm of the loved ones hand & if when stuck with a fist & produced a snapping sound, the loved one was true.",White,"Tap, Rhizome",Early Spring - Late Summer,Summer - Fall,Medium,Upright,Moderate,Minor,Minor,Full_Sun,10 -- 11,"Moderate, Dry",6.0 - 8.4,Insectory,"Medicine, Medicine, Medicine"
8311,Sand Poppy,Papaver arenarium,PAAR,Annual,29,23,2,Spring-Fall,Papaver arenarium native is range is E. Turkey to Central Asia and N. & Central Iran. Caucasus and Caspian regions. - Pollination by bees. Non mycorrhizal.,"Orange, Red","Tap, Rhizome",Early Summer - Late Summer,Summer - Fall,Medium,Upright,Moderate,Minor,Minor,Full_Sun,5 -- 10,Moderate,4.5 - 8.3,"Insectory, Wildlife Food","Food, Medicine, Ornamental"
2049,Potato,Solanum tuberosum,SOTU,Annual,12,12,18,,,,Tuber,,,Medium,Mound,Fast,Medium,Medium,"Full_Sun, Shade",2 -- 9,Moderate,,,"Biomass, Cleanser/Scourer, Food, Medicine"
3094,Prickly Caterpillar (Prickly Scorpion-Tail),Scorpiurus muricatus,SCMU,Annual,12,18,12,Spring-Summer,"Aka earthworm weed. Range: Mediterranean region - all Mediterranean countries except Libya. Habitat: Cultivated ground and dry places. Open grassland under cork oak, Holm oak etc, fruit orchards, fallows etc, generally on basic substrates such as limestones, marls, gypsums and clays; at elevations up to 1,200 metres. Prickly pods need to be bred out as well as multicycle germination in order for the plant to realize its full potential as a forage crop.","Blue, Purple, Yellow",Tap,Spring - Late Summer,Summer - Fall,Medium,Matlike,Fast,Minor,Minor,Full_Sun,8 -- 10,"Moderate, Dry",6.1 - 7.8,"Domestic Animal Forage, Groundcover, Nitrogen Fixer, Soil Builder","Food, Medicine"
7497,Desert Evening Primrose,Oenothera primiveris,OEPR,Annual,9,9,6,Spring,Other common names include bottle evening primrose and yellow desert evening primrose.,Yellow,Tap,Early Spring - Late Spring,Summer - Fall,Medium,Rosette,Fast,Minor,Minor,Full_Sun,6 -- 11,Dry,6.0 - 7.0,Insectory,"Medicine, Ornamental"
7496,Birdcage Evening Primrose,Oenothera deltoides,OEDE,Annual,10,36,0,Spring-Fall,"Other common names include desert lantern, desert evening primrose, and fragrant primrose. This species included five recognized varieties. Flowers open at sunset. Plants can be divided at any point in the year. Stress-deciduous. Best in full sun. Stems form a birdcage shape when dry.","Pink, White",,Early Spring - Early Fall,Fall - ?,Medium,Mound,Fast,Minor,Minor,"Full_Sun, Partial_Shade",7 -- 10,"Moderate, Dry",0.0 - 0.0,Insectory,"Aromatics/Fragrance, Ornamental"
2214,Pumpkin,Cucurbita maxima,CUMA,Annual,24,174,12,Fall,"Pumpkin is a warm-season vegetable that can be grown throughout much of the United States. Besides being used as jack-o'-lanterns at Halloween, pumpkins are used to make pumpkin butter, pies, custard, bread, cookies and soup.",,Fibrous Shallow,Summer - Early Fall,,,Vine,Fast,Medium,Medium,"Full_Sun, Partial_Shade",2 -- 9,Moderate,5.5 - 6.8,,"Food, Medicine"
2302,Purple Milkwort,Polygala sanguinea,POSA,Annual,12,12,12,Summer-Fall,"Purple or pink, sometimes greenish-white flower. This plant may be considered a protected species; check before digging or gathering seeds.","Green, Pink, Purple",Tap,Early Summer - Fall,Summer - Fall,Medium,Upright,Moderate,Minor,Minor,"Full_Sun, Partial_Shade",4 -- 8,"Moderate, Dry",6.6 - 7.5,Insectory,"Medicine, Medicine"
3593,Green Purslane,Portulaca oleracea,POOL,Annual,6,12,10,Spring-Summer,"The use of this plant as a vegetable, spice and medicinal plant has been known since the times of the ancient Egyptians and was popular in England during the Middle Ages.",Yellow,"Tap, Short Rhizome",Early Summer - Summer,Summer - Fall,Medium,Prostrate,Fast,Minor,Minor,"Full_Sun, Partial_Shade",4 -- 13,"Moderate, Dry",6.0 - 7.5,"Erosion Control, Groundcover, Insectory, Wildlife Food","Food, Medicine, Medicine"
2035,Pyrethrum,Chrysanthemum cinerariifolium,CHCI,Annual,20,12,,Spring,Daisy-like flowers,,,,,Medium,Upright,Fast,Minor,Minor,Full_Sun,6 -- 9,"Moderate, Dry",6.0 - 8.0,Herbicide,
3466,"Gallant Soldier, Quick Weed",Galinsoga parviflora,GAPA,Annual,28,18,8,Spring-Summer,"Communities in which the species occurs - Both species of galinsoga occupy disturbed ground, including flower beds, vegetable gardens, cultivated fields with low-growing crops, roadsides, waste ground, railway yards and dumps. Both species prefer open communities, where there is little competition for light.","Green, White, Yellow",Fibrous Shallow,Late Spring - Early Fall,Summer - Fall,Coarse,Mound,Fast,Minor,Minor,"Full_Sun, Partial_Shade",,"Wet, Moderate",6.5 - 7.5,Insectory,Food
3597,Blunt-leaved Rabbit-tobacco (Cudweed),Pseudognaphalium obtusifolium,PSOB,Annual,30,36,4,Spring-Summer,"Sweet Everlasting is a summer annual or biennial plant with silvery-green stems and leaves in the daisy family. This plant is a summer annual or biennial that is erect and eventually becomes ¾–2½' tall. Some plants overwinter as a low rosette of leaves, while others complete their growth and development within a single year. The underside of the leaves, stems and base of bracts of this plant are covered with dense white woolly hairs. The root system is fibrous and the plant propagates itself by self-seeding. It is usually found in openings, woodlands, coastal dunes, sandy pinelands, roadsides, and disturbed areas. There is no noticeable floral scent, although the foliage often has a balsam-like fragrance. Sweet Everlasting's older scientific name is Gnaphalium obtusifolium (by which it is still commonly referred).",White,Fibrous Shallow,Late Summer - Early Fall,Fall,Medium,Rosette,Fast,Minor,Minor,"Full_Sun, Partial_Shade",3 -- 11,"Moderate, Dry",6.1 - 7.8,"Insectory, Wildlife Food","Aromatics/Fragrance, Medicine, Medicine"
2206,Radish,Raphanus sativus,RASA,Annual,10,6,3,Summer-Fall,"Many varieties including globe, oval, oblong, long, daikon; maintain soil moisture for even growth; rotate crops to avoid disease",,Tap,,,Medium,Upright,Fast,Minor,Medium,Full_Sun,2 -- 9,Moderate,5.5 - 7.0,"Domestic Animal Forage, Insecticide, Nitrogen Scavenger, Soil Cultivator","Food, Medicine"
8046,Annual Ragweed,Ambrosia artemisiifolia,AMAR,Annual,0,,0,,,,,,,,,,,,,,,0.0 - 0.0,,
3306,Giant Ragweed (Buffalo Weed; Crownweed),Ambrosia trifida,AMTR,Annual,12,6,8,Spring-Fall,"A. trifida is found primarily in temperate areas around the world and is native to eastern North America; it is found throughout much of the USA and southern Canada. In Canada, this weed ranges from Nova Scotia westward to the Northwest Territory. Within the USA, it is most common in the mid-Atlantic states and the Ohio and Mississippi River valleys. A. trifida is most prevelant in disturbed sites such as, damp soils, wastelands, uncultivated and cultivated lands (field crops), garden, ditches, roadsides, field margins, constructions sites, etc. It may also be found colonising riverbanks, pastures and grasslands. A. trifida is common in flood plains and rare in low rainfall areas. Pollination is mainly performed by wind. A. trifida plants produce new stems and inflorescences when cut in late July and August.",Yellow,Fibrous Shallow,Early Summer - Late Summer,Summer - Fall,Medium,Upright,Fast,Medium,Minor,"Full_Sun, Partial_Shade",3 -- 12,Moderate,4.5 - 8.0,"Insecticide, Insectory, Nurse, Soil Builder, Soil Cultivator, Wildlife Food, Wildlife Food, Wildlife Habitat","Dye, Medicine, Medicine"
8178,Stinking Roger (Ganga Tulasi),Hyptis suaveolens,HYSU,Annual,90,48,12,All Year,"Hyptis suaveolens is an annual herb that grows in disturbed habitats. It is a prolific seed producer and in dense infestations can yield up to 3000 seeds/m2, forming persistent propagule banks within a short period. Thanks to its capability to stick to fur and cloth it disperses to undisturbed areas, where it can remain dormant for extended periods, until vegetation is cleared. This species originates from the Neotropics, from Central America and the West Indies south to about the tropic of Capricorn. It has been introduced to the tropics and subtropics of the world (including some Pacific Islands), where it has become widely naturalized. It is a weed of roadsides and cultivation, pastures, rangelands, grasslands, open woodlands, riverbanks, floodplains, coastal regions, disturbed sites, and waste areas. In India, it is found along rail tracks and roadsides, in foothills of open forests, forest clearings, and on wasteland particularly on arid and rocky substrates. It occurs at altitudes ranging from 0 to 1600 m. Vegetative growth in H. suaveolens begins either from rootstocks or seeds. Growth is rapid, and flowering can start at an early age of 2-3 months. Seeds are protected in sp","Lavender, Purple",Fibrous Deep,Late Summer - Late Winter,Spring - Winter,Medium,Upright,Fast,Minor,Minor,"Full_Sun, Partial_Shade",11 -- 13,Dry,4.5 - 8.0,"Insectory, Wildlife Habitat","Essential Oil, Food, Food, Insect Repellent, Insecticide, Spray, Medicine, Medicine"
3076,Roselle,Hibiscus sabdariffa,HISA,Annual,84,74,12,Summer-Fall,Susceptible to root knot nematodes. Can be a short-lived perennial in USDA zones 10 and 11. Blooms in fall in the USA. Fruits may not ripen in temperate regions. Can tolerate a range of soil types. Show photoperiodism. Deep roots.,"Red, Yellow",Tap,Summer - ?,Fall - Winter,Coarse,Upright,Fast,Major,Medium,Full_Sun,8 -- 11,"Wet, Moderate",5.5 - 8.5,"Domestic Animal Forage, Hedge, Insectory","Dye, Fiber, Food, Medicine, Oil, Wax, Resin or Polish, Oil, Wax, Resin or Polish, Ornamental"
2626,Rutabaga,Brassica napus napobrassica,BRNA,Annual,18,4,,Fall,Rutabagas resemble turnips producing a large edible root.,,Tap,Late Spring - Late Summer,,Medium,Upright,Fast,Minor,Minor,"Full_Sun, Partial_Shade",2 -- 9,Moderate,5.5 - 7.0,,"Food, Medicine"
3143,Santa Lucia,Ageratum conyzoides,AGCO,Annual,36,24,2,,"Fresh plant is malodorous. Highly adaptable to different ecological conditions. Stems may become woody with age. Self-pollinates. Best in high fertility soilA. conyzoides thrives best in rich, moist, mineral soils, and will not grow in the shade. It grows particularly well where soil fertility is high, with dense populations developing when fertilizer is used. Although preferring a moist habitat, it also grows in dry areas. A. conyzoides can complete its life cycle in less than 2 months. Although it can flower when less than two true leaves have expanded, it is more commonly seen in favourable conditions as a well-branched plant up to 90 cm tall with hundreds of flower heads. Propagation Seed - sow in situ","Blue, Pink, White",Fibrous Shallow,Summer - Fall,Summer - Fall,Coarse,Upright,Fast,Minor,Minor,"Full_Sun, Partial_Shade",8 -- 11,"Wet, Moderate, Dry",5.5 - 7.0,"Herbicide, Insecticide","Dye, Essential Oil, Medicine, Soap"
2203,Summer Savory,Satureja hortensis,SAHO,Annual,18,36,4,Summer,"Summer savory is a culinary herb and a good companion for onions and beans. Summer savory is grown from seeds sown directly in the garden or indoors and then transplanted after danger of frost is past. Sow seed shallow as light helps improve germination. Allow about 4-6 weeks to produce transplants. It prefers a full sun location in a well prepared soil that is moist, but well-drained. To insure a continuous supply of fresh leaves it is suggested to make successive sowings about 3-4 weeks apart.","Pink, White",Fibrous Deep,Summer - Late Summer,Summer - Fall,Medium,Upright,Fast,Minor,Minor,"Full_Sun, Partial_Shade",2 -- 9,"Moderate, Dry",5.5 - 8.3,"Fungicide, Insectory","Essential Oil, Food, Food, Medicine, Medicine, Soap"
3359,American Sea Rocket,Cakile edentula,CAED,Annual,24,18,6,Spring,"Non mycorrhizal species. Prefers a light well-drained soil and a sunny position. In North America, this succulent plant with tangy edible leaves is a common species of beaches and dunes. Propagation: Seed - sow late spring or early autumn in situ. Germination is usually rapid. May have an allelopathic affect on non Brassica species. The preference is full sun, moist to dry-mesic conditions, and very sandy soil. This plant also adapts to gravelly or rocky shorelines.","Blue, Pink, Purple, Red, White","Tap, Short Rhizome",Late Spring - Early Summer,Summer - Fall,Coarse,Rounded,Fast,Minor,Minor,Full_Sun,5 -- 9,"Moderate, Dry",3.5 - 6.5,"Erosion Control, Insectory, Reclamator, Soil Builder","Container Garden, Food"
3360,European Sea Rocket (Sea Caterpillar),Cakile maritima,CAMA,Annual,12,18,6,Spring,"Prefers a light well-drained soil and a sunny position. Plants are easily grown in a garden situation and can self-sow if the ground is disturbed by hoeing etc.The seeds of C. maritima require cold stratification. An annual, predominately found on sandy seashores and on fore-dunes. It is often very frequent along the winter storm tide-line where there is a good source of nutrients. It is rarer on shingle beaches and is only an occasional casual elsewhere. Seeds are dispersed by tides.","Lavender, Pink, Purple, White","Tap, Short Rhizome",Late Spring - Early Summer,Summer - Fall,Fine,Upright,Fast,Minor,Minor,Full_Sun,5 -- 3,Moderate,6.4 - 8.6,"Dynamic Accumulator, Erosion Control, Insectory, Reclamator","Food, Food, Medicine, Oil, Wax, Resin or Polish"
8174,Pepper Leaved Senna (Kasaunda),Senna sophera,SESO,Annual,96,48,12,Fall-Winter,"Senna sophera flowers throughout the year, most abundantly after rains. Common in grassland.",Yellow,"Tap, Rhizome",Late Fall - Winter,Winter,Coarse,Upright,Fast,Minor,Minor,"Full_Sun, Partial_Shade",11 -- 13,"Moderate, Dry",6.0 - 8.0,"Aromatic Pest Confuser, Insectory","Food, Insect Repellent, Medicine, Medicine, Ornamental"
6326,"Grasslands Koha, (Common Bird's Foot)",Ornithopus sativus,ORSA,Annual,48,24,12,Spring-Summer,"Small semi-viny annual herb adapted to moist sandy soils and cooler climates. Seed will regenerate each year, germinating in mid to late autumn after rain. With early rain, it can produce a large quantity of forage before winter. It grows slowly during winter, making its best growth after spring rain, when it flowers and seeds before dying in the heat of summer. Serradella seed has been traditionally sown as pod segments, in which the pod itself constitutes three quarters of the pod weight. Podded seed is very hard and little will germinate unless scarified through a dehulling machine. If the pod trash is not cleaned from the seed, it acts as a filler, making planting easier. The rhizobium for serradella does not occur naturally in the soil and has to be introduced with the seed at sowing. Inoculate pods or seed with Group G (lupin-serradella) inoculum which seems to nodulate serradella plants effectively on soils of pH 5.5-7.5. A new 'super serradella' inoculant has been developed for use on soils of lower pH. Serradella persists well under continuous grazing, with a carrying capacity of 1.5 to 3 wethers per hectare, or for cattle one adult beast per three hectares depending on se","Pink, Purple, White, Yellow",Fibrous Shallow,Late Spring - Early Summer,Summer - Fall,Medium,Upright,Fast,Minor,Minor,"Full_Sun, Partial_Shade",10 -- 12,"Moderate, Dry",4.0 - 6.5,"Domestic Animal Forage, Groundcover, Nitrogen Fixer, Soil Builder",
