Id,Name,Scientific name,Binomial,Plant Type,Height,Spread,Root Depth,Seasonal Interest,Notes,Flower Color,Root Type,Bloom Time,Fruit Time,Texture,Form,Growth Rate,Insect Predation,Disease,Light,Hardiness Zone,Soil Moisture,Soil pH,Ecological Function,Human Use/Crop
3337,"Summer Cypress (Common Kochia, Mirabel)",Bassia scoparia,BASC,Annual,7,8,60,Spring-Fall,"Kochia is an introduced, erect, annual forb with a taproot that forms pyramidal or rounded bushes up to 7 feet (2.1 m) tall. The roots of Bassia scoparia can reach a depth of at least 8 feet (2.4 m) and have a horizontal radius of at least 8 feet (2.4 m) which would allow the plant to draw water from a cylindrical soil mass 16 feet (4.9 m) in diameter and 8 feet (2.4 m) or more deep. Kochia is native to central and eastern Europe and Asia (Whitson et al., 1991) and was likely introduced as an ornamental in the mid- to late 1800’s. Germination of seeds can occur multiple times throughout the growing season (Friesen et al., 2009), enabling it to take advantage of moisture when it is available. Seeds are able to germinate under high stress conditions, such as lack of moisture, high salinity, or extremes in pH. Kochia is a facultative lkali halophyte and is tolerant of thin or high salinity soils or acidic soils due to the presence of aluminum or manganese.",Green,"Tap, Long Rhizome",Summer - Late Summer,Summer - Fall,Fine,Globe,Fast,Minor,Minor,Full_Sun,10 -- 12,"Moderate, Dry",6.0 - 8.0,"Domestic Animal Forage, Erosion Control, Groundcover, Reclamator, Toxin Absorber, Wildlife Food, Wildlife Habitat","Fiber, Food, Food, Insecticide, Spray, Medicine, Medicine, Ornamental"
2265,Gerbera Daisy,Gerbera jamesonii,GEJA,Annual,18,18,0,Summer,Long blooming daisy from Africa,"Orange, Purple, Red, White, Yellow",Fibrous Shallow,Early Summer - Early Fall,,Medium,Clump,Fast,Minor,Minor,"Full_Sun, Partial_Shade",2 -- 9,Moderate,5.1 - 5.5,Air Cleaner,Cut Flower
2464,Gloriosa Daisy,Venidium fastuosum,VEFA,Annual,36,8,,Summer-Fall,"These huge 4"" to 7"" flowers are great for cutting. They also work well in wildflower areas and reseed themselves.",Yellow,,Early Summer - Early Fall,,Medium,Upright,Fast,Minor,Minor,"Full_Sun, Partial_Shade",2 -- 9,Moderate,,,Cut Flower
3496,Red Dead Nettle (Purple Archangel),Lamium purpureum,LAPU,Annual,10,18,6,Spring-Fall,"The most distinctive characteristic of Purple Dead Nettle is the purple tint of the young leaves at the apex of the stem. With the exception of Lamium amplexicaule (Henbit), other Lamium spp. (Dead Nettles) in Illinois are uncommon perennial plants with larger flowers (¾"" or longer). Henbit is a sprawling weedy plant with sessile leaves near the flowers, while the same leaves of Purple Dead Nettle have short petioles. All of the species in this genus are native to Eurasia. The common name 'Dead Nettle' refers to the resemblance of the leaves to those members of the Nettle family with stinging hairs. However, Lamium spp. lack stinging hairs, therefore they are the safe, or 'dead,' nettles to be around.","Pink, Purple","Tap, Rhizome",Spring - Late Fall,Spring - Fall,Medium,Creeping,Fast,Minor,Minor,"Full_Sun, Partial_Shade",10 -- 11,Moderate,6.0 - 7.0,"Groundcover, Insectory","Cut Flower, Medicine"
2008,Dill,Anethum graveolens,ANGR,Annual,36,18,,Summer,Chartreuse flowers,Green,,Late Spring - Early Summer,,Fine,Upright,Fast,Minor,Minor,Full_Sun,2 -- 9,Moderate,5.3 - 7.8,"Insecticide, Insectory","Essential Oil, Food, Medicine"
2611,Dusty Miller,Pyrethrum ptarmicaeflorum,PYPT,Annual,12,10,,Summer,Silver-white cutleaf foliage.,,Fibrous Shallow,Early Spring,,Medium,Upright,Fast,Minor,Minor,"Full_Sun, Partial_Shade",2 -- 9,"Wet, Moderate, Dry",,,Container Garden
2216,Eggplant,Solanum melongena,SOME,Annual,36,24,8,Summer,Eggplant is a cold-sensitive vegetable that requires a long warm season for best yields,,Fibrous Deep,Summer - Early Fall,,Medium,Upright,Moderate,Major,Minor,Full_Sun,2 -- 9,Moderate,5.5 - 6.8,,"Container Garden, Food, Medicine"
2612,Elephant Ear,Hosta sieboldiana,HOSI,Annual,60,36,10,Summer,"Full morning sun can be beneficial. Requires well-drained soil. Bulbs can be dug up, stored for winter, and replanted each spring. Tolerant of proximity to black walnut trees. Better tolerance of slugs than most Hostas.","Lavender, White",Fibrous Shallow,Summer - ?,Summer - Fall,Medium,Arching,Slow,Minor,Minor,"Partial_Shade, Shade",2 -- 8,Moderate,5.5 - 7.5,"Erosion Control, Groundcover, Wildlife Food","Container Garden, Cut Flower, Food, Ornamental"
3095,Fenugreek (Methi),Trigonella foenum-graecum,TRFO,Annual,24,12,0,,"The flowers are considered papillonaceous, resembling a butterfly. They can be white, lemon-yellow or a purplish-blue in color and are born in the leaf axils. Ripens 90-150 days after planting. Best in well-drained and fertile soils. Tolerant of hillsides. Growth reduced in cold temperatures. Fenugreek is sometimes used as a short-rotation catch crop after sugarcane or cotton. In cooler areas, growth is slow and weak during cold periods and it is better grown as a summer crop. The seeds require warm dry weather for ripening and harvest. Fenugreek optimally grows in places where annual temperatures are in the range of 8-27°C and where annual rainfall is between 400-1500 mm. It is a full-sunlight species.","Blue, Cream, Purple, White, Yellow","Tap, Fibrous Deep",Late Spring - Summer,Summer - Fall,Medium,Upright,Fast,Medium,Medium,Full_Sun,9 -- 11,Moderate,5.3 - 8.2,"Domestic Animal Forage, Domestic Animal Forage, Nitrogen Fixer, Soil Builder, Soil Cultivator","Aromatics/Fragrance, Biomass, Container Garden, Dye, Essential Oil, Food, Food, Insect Repellent, Medicine, Medicine, Medicine, Soap"
2579,Spider Flower,Cleome hassleriana,CLHA,Annual,48,24,0,Summer,"Known as 'Spider Flower' or 'Grandma's Wiskers', cleome is a good insectory plant.","Lavender, Pink",,Late Spring - Early Fall,,Fine,Upright,Fast,Minor,Minor,"Full_Sun, Partial_Shade, Shade",2 -- 9,Moderate,6.6 - 7.8,,Cut Flower
3140,Foxtail,Acalypha alopecuroidea,ACAL,Annual,25,15,0,,Monoecious. Grows well on disturbed sites.,"Green, White",Tap,Spring - Fall,Spring - Fall,Coarse,Upright,,Medium,,"Full_Sun, Partial_Shade",9 -- 11,"Moderate, Dry",5.6 - 7.5,Domestic Animal Forage,"Fiber, Medicine"
3469,Dovefoot Geranium,Geranium molle,GEMO,Annual,16,12,0,Spring-Fall,"Sometimes an overwintering biennial. Can be non-mycorrhizal. The flowers are hermaphrodite and the plant can be self-fertile. Habitats include dry/rocky fields, cobbly soils, banks, yards, and other waste places. Self-seeding.",Pink,Tap,Spring - Early Fall,Summer - Fall,Medium,Rosette,Moderate,Minor,Minor,Full_Sun,6 -- 9,"Wet, Moderate, Dry",5.5 - 7.5,"Groundcover, Insectory","Medicine, Medicine, Ornamental"
2191,Scented Geranium,Pelargonium graveolens,PEGR,Annual,24,18,,Summer-Fall,"Flowers vary: blue, violet, lavender, pink, variegated. Foliage adds to perennial garden texture.","Lavender, Pink, Purple, Red",Rhizome,Early Summer - Early Fall,,Medium,Mound,Fast,Minor,Minor,Partial_Shade,2 -- 8,Moderate,6.1 - 7.8,Aromatic Pest Confuser,"Essential Oil, Food, Medicine"
7423,Globe Gilia,Gilia capitata,GICA,Annual,36,24,0,Spring-Summer,"Annual or perennial. Other common names include blue gilia, blue-head gily-flower, blue thimble flower and queen anne's thimbles. Grow in well-drained soils. Self-sows readily. Often establishes after fires. Grows naturally on rocky slopes and hillsides. Some sources list hardiness down to zone 3.","Blue, Lavender, Pink, Purple, White",Tap,Late Winter - Spring,Summer - Fall,Fine,Upright,Moderate,Minor,Medium,"Full_Sun, Partial_Shade",4 -- 10,"Moderate, Dry",5.5 - 7.6,Insectory,"Container Garden, Cut Flower, Food, Ornamental"
7487,Coulter's Globemallow,Sphaeralcea coulteri,SPCO,Annual,48,48,0,,Flowers profusely in years with ample rain. Takes the form of an herb or subshrub that is sprawling or erect. Flowers are rarely white or lavender.,Orange,,Winter - Late Spring,Summer - ?,Medium,Upright,Fast,,,Full_Sun,9 -- 11,"Moderate, Dry",6.0 - 8.0,Insectory,Ornamental
2466,Bunny Tails Grass,Lagurus ovatus,LAOV,Annual,20,6,,Summer,"Bunny Tails forms an upright fountain of charming, soft and fluffy flower heads, as soft as a bunny's tail! Very drought tolerant once established.",White,,Early Summer - Late Summer,,Fine,Single Stem,Fast,Minor,Minor,"Full_Sun, Partial_Shade",2 -- 9,Moderate,,,Cut Flower
8732,Rattail Sixweeks Grass (Annual Fescue),Vulpia myuros,VUMY,Annual,18,20,6,Summer-Fall,"Also called Silver Grass. Because it is an annual, rattail sixweeks grass cannot sprout from the root crown after it produces seed. It dies. However, sixweeks grasses (Vulpia spp.) may die back to and sprout from the root crown when wet weather follows a short-term dry period during the growing season. Rattail sixweeks grass is most important in grasslands, open-canopy forests, woodlands, and shrublands (see Distribution and Occurrence) that are maintained by frequent fire. It is well adapted to short-return-interval grassland fires, which are characterized by flashy fuels and rapid fire fronts that burn through quickly and cause little soil heating and damage to seed. Vulpia myuros is an annual grass, native to much of Europe and parts of Asia, introduced to the USA, Australia and a number of other countries, and reported as invasive in Australia, the western USA and parts of the Pacific. It outcompetes native species in grasslands of the western US and is a significant agricultural weed. It forms dense swards and its shallow roots suppress growth of native grasses and forbs. Establishment of native plants is strongly hindered once it has become dominant; because it is a winter-an",Green,Fibrous Shallow,Late Spring - Early Fall,Summer - Fall,,,Fast,Minor,Minor,"Full_Sun, Partial_Shade",10 -- 12,"Moderate, Dry",4.5 - 8.5,"Erosion Control, Erosion Control, Groundcover, Insectory, Reclamator, Toxin Absorber, Wildlife Food, Wildlife Food",
8373,Sickle Grass (Coast Barbgrass),Parapholis incurva,PAIN,Annual,12,12,24,All Year,"Parapholis incurva is a species of annual tufted grass native to Europe, Asia and northern Africa, & widely naturalized elsewhere. It is widespread in the old world, occurring in northern Africa, Europe, and Asia. It has widely naturalized elsewhere- HABITAT: coastal, salt-marsh. Occurs usually in non wetlands, occasionally in wetlands. Grey sand, calcareous loam, often saline. Saline flats, salt lakes, saltmarshes, beach sandhills. COMMUNITIES: Coastal Strand, Coastal Salt Marsh, wetland-riparian. - ELEVATION: 0 to 1245 feet. - It is a tufted annual bunchgrass. It was first published as Aegilops incurva by Carl Linnaeus, and transferred into Parapholis by Charles Edward Hubbard in 1946. Spikelet: bisexual. Flower: bisexual, cleistogamous. Grows in both poorly drained and well drained disturbed soils at and above the high tide mark. It tends to grow in more saline soils, & at lower elevations with respect to the tide, than P. strigosa. PROPAGATION: Seeds, cuttings.",Green,Fibrous Deep,Late Spring - Summer,Summer - Fall,Medium,Clump,Moderate,Minor,Minor,Full_Sun,9 -- 11,"Wet, Moderate",5.5 - 8.1,"Domestic Animal Forage, Erosion Control, Reclamator, Soil Cultivator, Wildlife Habitat","Ornamental, Ornamental"
3366,Hemp,Cannabis sativa,CASA,Annual,98,12,36,Spring,"Cannabis is very adaptable to soil and climatic conditions. It prefers a rich loamy soil with plenty of humus] but it succeeds in ordinary garden soil and also in calcareous soils. When grown for fibre, it requires a mild temperate climate with at least 67cm annual rainfall, with abundant rain whilst the seeds are germinating and until young plants become established. Cannabis thrives on rich, fertile, neutral to slightly alkaline, well-drained silt or clay loams with moisture retentive subsoils, it does not grow well on acid, sandy soils. Of the many types of hemp, some are adapted to most vegetated terrains and climates. Cannabis is reported to tolerate an annual precipitation range of 30 to 400cm, an average annual temperature range of 6 to 27C and a pH in the range of 4.5 to 8.2. Different cultivars of the species have been bred for both higher and lower THC (the component used as an euphoric drug) and CBDs (the component used for pain and inflammatory relief). Plants require little cultivation, except for weeding during early stages of growth. Hemp grows rapidly and soon crowds out weeds. After the plants are 20 cm tall, weeding is abandoned. Hemp tends to exhaust the soil.","Green, Pink, Purple","Tap, Fibrous Deep",Summer - Early Fall,Summer - Fall,Medium,Upright,Fast,Minor,Minor,Full_Sun,8 -- 11,Moderate,4.5 - 8.2,"Erosion Control, Soil Builder, Soil Cultivator, Toxin Absorber","Biomass, Fiber, Medicine, Medicine, Oil, Wax, Resin or Polish"
3495,Henbit (Common Dead Nettle),Lamium amplexicaule,LAAM,Annual,8,16,4,Spring-Summer,"This annual grows from a shallow taproot that becomes finely branched. The low-growing, upright to sprawling plants have a number of weak stems arising from the base that may be erect or lay almost horizontal on the ground. The stems are green but often become purple with age, and may root at the low nodes. The finely hairy stems are covered with downward-pointing hairs. Plants may be 4 to 15 inches tall. They either die after setting seed or go dormant during the hot weather of summer and bloom in the fall. Henbit grows best in cool, moist areas. It is primarily a problem in open areas of gardens or in weak, thin lawns. It can be discouraged in lawns by maintaining a dense turf through proper mowing and fertilization, and in shaded lawns by growing grass species more adapted to less sun which will better compete with weeds. Although often classified as an annual plant, this species may overwinter as a seedling or as a seed and become a biennial. Seedlings emerge from moist, cool soil in autumn and early spring. Seedling emergence occurs when the temperature is 5-25°C, optimally 15-20°C, and is inhibited by dry, cool soils.","Pink, Purple","Tap, Rhizome",Spring - Fall,Summer - Fall,Medium,Matlike,Fast,Minor,Minor,"Partial_Shade, Shade",9 -- 11,Moderate,6.0 - 7.0,"Erosion Control, Insectory, Reclamator, Wildlife Food","Food, Medicine"
7976,Temperate Holy Basil,Ocimum africanum,OCAF,Annual,24,16,6,Spring-Summer,"From Richo Cech at Strictly Medicinal Seeds ""Temperate Tulsi (AKA: “Holy Basil,” Latin unknown) was introduced by the now-defunct Abundant Life Seed Foundation. The plant has been grown successfully as a quick summer annual and is well-loved by American gardeners. The aroma is tutti-frutti, the plant bolts fast to flower, it magnetizes bees and is the only basil I know of that readily self-seeds from seed dropped the year before. To make the most of the leaf, it works best to direct-seed the plant in the spring garden and harvest on an ongoing basis, cutting back just prior to flowering. The plants are globe-shaped and do not get very tall–a foot or two at best. Careful management of the timing of planting and harvest can result in a good deal of dried tea from a few plants. This is the tea that we grow and dry for our own personal use, and it has been shown to be a healthy drink for our family. Here are the results of one of our analytical tests of Temperate Tulsi: 0.74 Eugenol, 5.53 Rosmarinic Acid expressed as dried wt in mg/g.""",,"Fibrous Shallow, Short Rhizome",Early Summer - Early Fall,Summer - Fall,Medium,Mound,Fast,Minor,Minor,Full_Sun,,Moderate,6.0 - 7.5,Insectory,"Aromatics/Fragrance, Container Garden, Essential Oil, Essential Oil, Food, Food"
2470,Impatiens,Impatiens wallerana,IMWA,Annual,6,6,,Summer-Fall,"The flower petals shimmer with an unusual glow in pink, coral and peach, surrounded by a darker petal margin that distinctively sets off each bloom. Best planted grouped in beds or borders.","Pink, Red, White, Yellow",,Early Summer - Early Fall,,Medium,Mound,Fast,Minor,Minor,"Partial_Shade, Shade",2 -- 9,Moderate,,,Hanging Basket
3578,Desert Indianwheat (Psyllium),Plantago ovata,PLOV,Annual,18,18,12,Summer,,"Cream, White","Tap, Fibrous Shallow",Winter - Spring,Summer - Fall,Medium,Rosette,Fast,Minor,Minor,Full_Sun,8 -- 13,"Moderate, Dry",6.5 - 9.0,"Domestic Animal Forage, Insectory","Food, Medicine"
2516,Jewelweed,Impatiens capensis,IMCA,Annual,55,30,14,Summer,"The Jewelweed has Green foliage and inconspicuous Yellow flowers, with inconspicuous Brown fruits or seeds.",Yellow,Fibrous Shallow,Summer - Fall,,Medium,Upright,Fast,,,"Full_Sun, Partial_Shade, Shade",2 -- 9,Moderate,6.4 - 7.4,,"Food, Medicine"
3281,China Jute,Abutilon theophrasti,ABTH,Annual,84,48,12,Summer-Fall,"Whether as foreign material in crop seed or as an intended fiber crop, velvetleaf arrived in North America probably before 1700, and became widespread along the East Coast by the early 1700s. Because the colonies desperately needed fiber for rope and cloth, velvetleaf was widely cultivated in the mid-1700s. Although attempts to process velvetleaf fiber never succeeded economically, U. S. farmers continued to cultivate it for more than 100 years. A. theophrasti has some freely moving leaves that maintain a small angle between the normal to the leaf and the sun's rays . The freely moving leaves have higher total daily carbon gain, transpiration and water use efficiency than leaves fixed in a horizontal position. Propagation is always by seeds, which are produced in large numbers, varying from 700 to 44,200 per plant. Seeds mature 17-22 days after pollination. Seeds are dispersed by opening of each carpel with a vertical slit along the outer edge. Seeds are known to remain viable for up to 50 years when stored dry or in the soil. It is known to have developed resistance to many herbicides used in agriculture.","Orange, Yellow","Tap, Short Rhizome",Late Summer - Early Fall,Summer - Fall,Coarse,Upright,Fast,Minor,Minor,"Full_Sun, Partial_Shade",4 -- 9,"Moderate, Dry",4.9 - 8.2,"Fungicide, Insectory, Wildlife Food, Wildlife Food","Fiber, Food, Medicine, Oil, Wax, Resin or Polish, Oil, Wax, Resin or Polish"
2221,Kale,Brassica oleracea acephala,BROL,Annual,30,18,6,Summer,"An easily grown, hardy plant, cultivated for its edible leaves.",,Tap,,,,Upright,Fast,Minor,Minor,"Full_Sun, Partial_Shade",2 -- 9,Moderate,4.2 - 8.3,,"Container Garden, Food"
3417,Abyssinian Kale (Crambe),Crambe hispanica subsp. abyssinica,CRHI,Annual,39,24,7,Spring,"The plant has a short growing season of from 90 - 100 days. The plant does best on medium-light to heavy soils that are fertile and well drained, though poor sandy soils may be used if nutrients are provided. A cool season crop, it is well-adapted as a spring crop in wheat-growing areas of the Pacific north-western United States. A spring and fall crop can be grown, e.g. in Indiana. Grown as far south as Venezuela and as far north as Sweden and Leningrad. In the seedling stage, it survives temperatures down to -5C. It fares poorly where weeds are a problem. From planting to harvest requires about 100 days, but this may vary considerably. Plants are harvested after leaves have dropped and seed pods and stems have turned light straw colored, with combine either cut directly or after swathing. Oilseeds with high oil content such as crambe are usually processed in a two-step operation with half the oil pressed out and the rest extracted with a solvent. A non mycorrhizal species.","White, Yellow","Tap, Short Rhizome",Spring - Early Summer,Spring - Summer,Coarse,Upright,Fast,Medium,Medium,"Full_Sun, Partial_Shade",6 -- 9,"Wet, Moderate",5.0 - 7.8,"Domestic Animal Forage, Domestic Animal Forage, Domestic Animal Forage, Erosion Control, Groundcover, Herbicide, Insecticide, Nitrogen Scavenger, Soil Builder, Water Purifier, Water Purifier","Biomass, Essential Oil, Fiber, Oil, Wax, Resin or Polish, Oil, Wax, Resin or Polish, Oil, Wax, Resin or Polish"
2609,Ornamental Kale,Brassica oleracea,BROL,Annual,32,12,,Summer-Fall,As lovely as roses but sturdier. Use as cut flowers.,"Red, White",,Summer - Early Fall,,,Upright,Fast,Minor,Minor,Partial_Shade,2 -- 9,Moderate,,,Cut Flower
3393,Kaniwa (Canahua),Chenopodium pallidicaule,CHPA,Annual,24,30,12,Spring,"""Succeeds on most soils, including shallow soils, but dislikes shade. Prefers a moderately fertile soil. Once the plant is about 5cm tall it is very drought tolerant. The plant has short stout stems and resists wind and heavy rain. It is also more resistant than barley or quinoa to low night temperatures. Plants do not like excess humidity. Adult plants are unaffected by night frosts in the growing season, the seed can germinate at a soil temperature of 5c, whilst the plant will flower at 10c and ripen its seed at 15c. The flowers are closed at fertility and so seem to be almost exclusively self-pollinating. Kaniwa is so cold hardy that in the high Andes it serves subsistence farmers as a “safety-net.” When all else fails, kaniwa still provides food. Indeed, it is perhaps more resistant than any other grain crop to a combination of frost, drought, salt, and pests—and few other food plants are as easy to grow or demand such little care. Moreover, although its grains are small, few cereals can match their protein content of around 16 percent. .",Yellow,"Tap, Rhizome",Spring - ?,Spring - ?,Fine,Spreading,Slow,Minor,Minor,Full_Sun,8 -- 11,"Moderate, Dry",4.8 - 8.5,Domestic Animal Forage,"Dye, Food, Food, Food, Medicine, Medicine"
8301,Khatma (Ludwig's Marshmallow),Althaea ludwigii,ALLU,Annual,16,24,6,Spring-Fall,"Native to northern Africa, the Middle East, central Asia, & India, and disjunctly to Namibia & South Africa. Afghanistan, Algeria, Cape Provinces, Egypt, India, Iran, Iraq, Kuwait, Libya, Mauritania, Morocco, Namibia, Oman, Pakistan, Palestine, Saudi Arabia, Sinai, Tadzhikistan, Tunisia, Turkmenistan, Uzbekistan, Western Sahara. Ludwig's Marshmallow is an annual or short-lived perennial growing to up to 16 inches high, but often much less, with a thick vertical root. A desert-adapted annual, somewhat weedy, found in cultivated land & on roadsides. It can be found on river banks and in salty marshland. The plants presence on marsh lands led to its common name of marshmallow. Common Names: MarshMallow Plant, Marsh mallow, Hollyhock, Mallards, Sweet Weed, Hairy Marshmallow, Rough Marshmallow. PROPAGATION: Seeds. Sow Inside. Following the last frost. Spacing 10 to 40 inches. Sow Inside: Mix seeds in a growing medium; keep soil moist, place in a freezer bag, then stratify by refrigeration for two weeks. Use peat pots. Germination time: one to two weeks. Temperature 60 to 65°F. Seven or eight weeks in advance. Transplant outdoors following the last frost or in autumn. Provide support.","Pink, White, Yellow","Tap, Rhizome",Summer - Late Summer,Summer - Fall,Coarse,Spreading,Fast,Minor,Minor,"Full_Sun, Partial_Shade",3 -- 10,"Moderate, Dry",6.0 - 7.5,Insecticide,"Food, Medicine, Ornamental"
2459,Kiwicha (Love Lies Bleeding),Amaranthus caudatus,AMCA,Annual,48,24,10,Summer,"The erect form of Amaranth is a nice dried flower accent while the tassel form can be quite dramatic. Kiwicha and other amaranths adapt to many environments and tolerate adversity because they convert the raw materials of soil, sunlight, and water into plant tissues by using an especially efficient type of photosynthesis. Known technically as the C4 carbon-fixation pathway, this process is particularly efficient at high temperature, in bright sunlight, and under dry conditions. Plants using it tend to require less water than those that use the more common C3 carbon-fixation pathway. The seeds may germinate in as little as three days, but the seedlings are slow starters and are easily overwhelmed by weeds. Once established, however, they grow quickly and their maintenance is relatively easy. Kiwicha seems to have daylength sensitivity. As noted, the varieties so far tested in the United States have not grown well, apparently because of daylength incompatibility.",Rose,"Tap, Rhizome",Early Summer - Late Summer,Summer - Fall,Medium,Upright,Fast,Minor,Minor,"Full_Sun, Partial_Shade",4 -- 9,Moderate,6.0 - 8.0,Domestic Animal Forage,"Biomass, Dried Flower, Dye, Food, Medicine, Medicine, Ornamental"
3409,Blessed Knapweed (Blessed Thistle),Centaurea benedicta,CEBE,Annual,24,24,6,Summer,"Previously named Cnicus benedictus, Blessed knapweed is a Eurasian native, now introduced throughout the world. S. Europe to W. Asia. An infrequent casual in Britain. - Native to the Mediterranean region, from Portugal north to southern France and east to Iran. Afghanistan, Africa, Argentina, Asia, Australia, Brazil, Britain, Canada, Caucasus, Chile, Czech, Europe, France, Germany, Iran, Iraq, Italy, Kurdistan, Macedonia, Mediterranean, North Africa, North America, Romania, Russia, Slovakia, South Africa, Southern Africa, South America, Spain, Turkey, Uruguay.. - HABITAT: Anthropogenic (man-made or disturbed habitats), meadows and fields. Dry, sunny places in arable, stony, & waste ground. Cultivated Beds - Species is hermaphrodite (has both male & female organs). POLLINATION: by Insects. - Cannot grow in the shade. It prefers dry or moist soil. PROGATION: Seed - sow in situ in the spring or early autumn. The seed usually germinates in 2 - 6 weeks. - It was very much in vogue in the 16th century, Shakespeare extolled it as an excellent remedy for palpitations.",Yellow,"Tap, Short Rhizome",Summer - Fall,Summer - Fall,Coarse,Upright,Slow,Minor,Minor,Full_Sun,7 -- 10,"Moderate, Dry",6.0 - 7.0,"Insectory, Wildlife Habitat","Food, Food, Medicine, Medicine, Medicine, Medicine, Medicine, Medicine, Medicine, Oil, Wax, Resin or Polish, Ornamental"
